{
  "schema": "archeaxis.learning-feedback/v1",
  "event_id": "evt_l1",
  "learner_id": "learner-a",
  "event": "question_answered",
  "item_ref": {"kind": "question", "id": "q_1", "source_revision_id": "rev_9"},
  "outcome": {"rating": "incorrect", "reported_answer": "Paris", "learner_note": "mixed up with London"},
  "schedule": {"algorithm": "fsrs", "interval_days": 0.5},
  "occurred_at": "2026-09-05T08:00:00Z"
}
